book_title,author,year,bans_PEN,text_summary,bans_states,bans_status,list
Burned,"Hopkins, Ellen",2006,11,"I do know things really began to spin out of control after my first sex dream. It all started with a dream. Nothing exceptional, just a typical fantasy about a boy, the kind of dream that most teen girls experience. But Pattyn Von Stratten is not like most teen girls. Raised in a religious—yet abusive—family, a simple dream may not be exactly a sin, but it could be the first step toward hell and eternal damnation. This dream is a first step for Pattyn. But is it to hell or to a better life? For the first time Pattyn starts asking questions. Questions seemingly without answers—about God, a woman's role, sex, love—mostly love. What is it? Where is it? Will she ever experience it? Is she deserving of it? It's with a real boy that Pattyn gets into real trouble. After Pattyn's father catches her in a compromising position, events spiral out of control until Pattyn ends up suspended from school and sent to live with an aunt she doesn't know. Pattyn is supposed to find salvation and redemption during her exile to the wilds of rural Nevada. Yet what she finds instead is love and acceptance. And for the first time she feels worthy of both—until she realizes her old demons will not let her go. Pattyn begins down a path that will lead her to a hell—a hell that may not be the one she learned about in sacrament meetings, but it is hell all the same. In this riveting and masterful novel told in verse, Ellen Hopkins takes readers on an emotional roller-coaster ride. From the highs of true love to the lows of abuse, Pattyn's story will have readers engrossed until the very last word.","Colorado (1), Florida (4), Tennessee (2), Texas (2), Virginia (1), Wyoming (1)","Banned (5), Banned by Restriction (4), Banned Pending Investigation (2)",
Concrete Rose,"Thomas, Angie",2021,8,"International phenomenon Angie Thomas revisits Garden Heights seventeen years before the events of The Hate U Give in this searing and poignant exploration of Black boyhood and manhood. If there’s one thing seventeen-year-old Maverick Carter knows, it’s that a real man takes care of his family. As the son of a former gang legend, Mav does that the only way he knows how: dealing for the King Lords. With this money he can help his mom, who works two jobs while his dad’s in prison. Life’s not perfect, but with a fly girlfriend and a cousin who always has his back, Mav’s got everything under control. Until, that is, Maverick finds out he’s a father. Suddenly he has a baby, Seven, who depends on him for everything. But it’s not so easy to sling dope, finish school, and raise a child. So when he’s offered the chance to go straight, he takes it. In a world where he’s expected to amount to nothing, maybe Mav can prove he’s different. When King Lord blood runs through your veins, though, you can't just walk away. Loyalty, revenge, and responsibility threaten to tear Mav apart, especially after the brutal murder of a loved one. He’ll have to figure out for himself what it really means to be a man.","Florida (3), Tennessee (3), Texas (2)","Banned Pending Investigation (2), Banned (5), Banned by Restriction (1)",
Crank,"Hopkins, Ellen",2004,17,"In Crank, Ellen Hopkins chronicles the turbulent and often disturbing relationship between Kristina, a character based on her own daughter, and the ""monster,"" the highly addictive drug crystal meth, or ""crank."" Kristina is introduced to the drug while visiting her largely absent and ne'er-do-well father. While under the influence of the monster, Kristina discovers her sexy alter-ego, Bree: ""there is no perfect daughter, / no gifted high school junior, / no Kristina Georgia Snow. / There is only Bree."" Bree will do all the things good girl Kristina won't, including attracting the attention of dangerous boys who can provide her with a steady flow of crank.","Colorado (1), Florida (4), Georgia (1), Iowa (2), Pennsylvania (1), Tennessee (3), Texas (3), Virginia (1), Wyoming (1)","Banned (11), Banned by Restriction (4), Banned Pending Investigation (2)","ALA_top_10, PEN_top_10"
Damsel,"Arnold, Elana K.",2018,16,"The rite has existed for as long as anyone can remember: when the prince-who-will-be-king comes of age, he must venture out into the gray lands, slay a fierce dragon, and rescue a damsel to be his bride. This is the way things have always been. When Ama wakes in the arms of Prince Emory, however, she knows none of this. She has no memory of what came before she was captured by the dragon, or what horrors she has faced in its lair. She knows only this handsome prince, the story he tells of her rescue, and her destiny to sit on the throne beside him. Ama comes with Emory back to the kingdom of Harding, hailed as the new princess, welcomed to the court. However, as soon as her first night falls, she begins to realize that not all is as it seems, that there is more to the legends of the dragons and the damsels than anyone knows–and that the greatest threats to her life may not be behind her, but here, in front of her.","Florida (9), Iowa (2), Tennessee (1), Texas (3), Virginia (1)","Banned (13), Banned Pending Investigation (1), Banned by Restriction (2)",PEN_top_10
Darius the Great Deserves Better,"Khorram, Adib",2020,7,"In this companion to the award-winning Darius the Great Is Not Okay, Darius suddenly has it all: a boyfriend, an internship, a spot on the soccer team. It’s everything he’s ever wanted–but what if he deserves better? Darius Kellner is having a bit of a year. Since his trip to Iran this past spring, a lot has changed. He’s getting along with his dad, and his best friend Sohrab is only a Skype call away. Between his first boyfriend, Landon, his varsity soccer practices, and his internship at his favorite tea shop, Darius is feeling pretty okay. Like he finally knows what it means to be Darius Kellner. Then, of course, everything changes. Darius’s grandmothers are in town for a long visit while his dad is gone on business, and Darius isn’t sure whether they even like him. The internship isn’t what Darius thought it would be, and now he doesn’t know about turning tea into his career. He was sure he liked Landon, but when he starts hanging out with Chip–soccer teammate and best friend of Trent Bolger, epic bully–well, he’s just not so sure about Landon anymore, either. Darius thought he knew exactly who he was and what he wanted, but maybe he was wrong. Maybe he deserves better.","Florida (2), Tennessee (2), Texas (2), Virginia (1)","Banned Pending Investigation (1), Banned (4), Banned by Restriction (2)",
Dime,"Frank, E. R.",2015,7,"The startling realities of teen prostitution are revealed in this eye-opening, heartbreaking story from the author of America, which Booklist called “a piercing, unforgettable novel” and Kirkus Reviews deemed “a work of sublime humanity.” As a teen girl in Newark, New Jersey, lost in the foster care system, Dime just wants someone to care about her, to love her. A family. And that is exactly what she gets—a daddy and two “wifeys.” So what if she has to go out and earn some coins to keep her place? It seems a fair enough exchange for love. Dime never meant to become a prostitute. It happened so gradually, she pretty much didn’t realize it was happening until it was too late. But when a new “wifey” joins the family and Dime finds out that Daddy doesn’t love her the way she thought he did, will Dime have the strength to leave? And will Daddy let her?","Florida (3), Tennessee (1), Texas (3)","Banned Pending Investigation (1), Banned (5), Banned by Restriction (1)",
Empire of Storms,"Maas, Sarah J.",2016,15,"The long path to the throne has only just begun for Aelin Galathynius as war looms on the horizon. Loyalties have been broken and bought, friends have been lost and gained, and those who possess magic find themselves at odds with those who don't. With her heart sworn to the warrior-prince by her side, and her fealty pledged to the people she is determined to save, Aelin will delve into the depths of her power to protect those she loves. But as monsters emerge from the horrors of the past, and dark forces become poised to claim her world, the only chance for salvation will lie in a desperate quest that may mark the end of everything Aelin holds dear. In this breathtaking fifth installment of the New York Times bestselling Throne of Glass series, Aelin will have to choose what—and who—to sacrifice if she's to keep the world of Erilea from breaking apart.","Florida (8), Iowa (2), Tennessee (3), Texas (1), Virginia (1)","Banned (14), Banned by Restriction (1)",
Extremely Loud and Incredibly Close,"Foer, Jonathan Safran",2005,7,"In a vase in a closet, a couple of years after his father died in 9/11, nine-year-old Oskar discovers a key... The key belonged to his father, he's sure of that. But which of New York's 162 million locks does it open? So begins a quest that takes Oskar - inventor, letter-writer and amateur detective - across New York's five boroughs and into the jumbled lives of friends, relatives, and complete strangers. He gets heavy boots, he gives himself little bruises and he inches ever nearer to the heart of a family mystery that stretches back fifty years. But will it take him any closer to, or further from, his lost father?","Florida (2), Iowa (1), Tennessee (2), Texas (2)","Banned Pending Investigation (1), Banned (5), Banned by Restriction (1)",
Fade,"McMann, Lisa",2009,7,"For Janie and Cabel, real life is getting tougher than the dreams. They're just trying to carve out a little (secret) time together, but no such luck. Disturbing things are happening at Fieldridge High, yet nobody's talking. When Janie taps into a classmate's violent nightmares, the case finally breaks open -- but nothing goes as planned. Not even close. Janie's in way over her head, and Cabe's shocking behavior has grave consequences for them both. Worse yet, Janie learns the truth about herself and her ability -- and it's bleak. Seriously, brutally bleak. Not only is her fate as a dream catcher sealed, but what's to come is way darker than she'd feared....","Florida (3), Tennessee (2), Texas (2)","Banned Pending Investigation (2), Banned (5)",
Fallout,"Hopkins, Ellen",2010,11,"Different homes. Different guardians. Different last names. Different lives. But there is one person who binds them together. Kristina. Nineteen years after Kristina Snow met the monster---crank---her children are reeling from the consequences of her decisions. Instead of one big, happy family, they are a desperate tangle of scattered lives united by anger, doubt, and fear. A predisposition to addiction and a sense of emptiness where a mother's love should be leads all three down the road of their mother's notorious legacy. Sex, drugs, alcohol, abuse---there is more of Kristina in her children than they would ever like to believe. But when the thread that ties them together brings them face-to-face, they'll discover something powerful in each other and in themselves---the trust, the hope, the courage to begin to break the cycle. Fallout is bestselling author Ellen Hopkin's riveting conclusion to her trilogy begun by Crank and Glass. It is a revelation and a testament to the harsh reality that addiction is never just one person's problem.","Colorado (1), Florida (3), Tennessee (2), Texas (3), Virginia (1), Wyoming (1)","Banned (6), Banned Pending Investigation (2), Banned by Restriction (3)",
Felix Ever After,"Callender, Kacen",2020,8,"From Stonewall and Lambda Award-winning author Kacen Callender comes a revelatory YA novel about a transgender teen grappling with identity and self-discovery while falling in love for the first time. Felix Love has never been in love—and, yes, he’s painfully aware of the irony. He desperately wants to know what it’s like and why it seems so easy for everyone but him to find someone. What’s worse is that, even though he is proud of his identity, Felix also secretly fears that he’s one marginalization too many—Black, queer, and transgender—to ever get his own happily-ever-after. When an anonymous student begins sending him transphobic messages—after publicly posting Felix’s deadname alongside images of him before he transitioned—Felix comes up with a plan for revenge. What he didn’t count on: his catfish scenario landing him in a quasi–love triangle.... But as he navigates his complicated feelings, Felix begins a journey of questioning and self-discovery that helps redefine his most important relationship: how he feels about himself. Felix Ever After is an honest and layered story about identity, falling in love, and recognizing the love you deserve.","Florida (2), Nation (1), Tennessee (3), Texas (2)","Banned Pending Investigation (1), Banned (6), Banned by Restriction (1)",
Flamer,"Curato, Mike",2020,9,"Award-winning author and artist Mike Curato draws on his own experiences in Flamer, his debut graphic novel, telling a difficult story with humor, compassion, and love. I know I’m not gay. Gay boys like other boys. I hate boys. They’re mean, and scary, and they’re always destroying something or saying something dumb or both. I hate that word. Gay. It makes me feel . . . unsafe. It's the summer between middle school and high school, and Aiden Navarro is away at camp. Everyone's going through changes—but for Aiden, the stakes feel higher. As he navigates friendships, deals with bullies, and spends time with Elias (a boy he can't stop thinking about), he finds himself on a path of self-discovery and acceptance.","Florida (2), Iowa (2), Oregon (1), Tennessee (2), Texas (2)","Banned Pending Investigation (1), Banned (7), Banned by Restriction (1)",ALA_top_10
Forbidden,"Suzuma, Tabitha",2010,8,"She is pretty and talented - sweet sixteen and never been kissed. He is seventeen; gorgeous and on the brink of a bright future. And now they have fallen in love. But... they are brother and sister. Seventeen-year-old Lochan and sixteen-year-old Maya have always felt more like friends than siblings. Together they have stepped in for their alcoholic, wayward mother to take care of their three younger siblings. As defacto parents to the little ones, Lochan and Maya have had to grow up fast. And the stress of their lives—and the way they understand each other so completely—has also brought them closer than two siblings would ordinarily be. So close, in fact, that they have fallen in love. Their clandestine romance quickly blooms into deep, desperate love. They know their relationship is wrong and cannot possibly continue. And yet, they cannot stop what feels so incredibly right. As the novel careens toward an explosive and shocking finale, only one thing is certain: a love this devastating has no happy ending.","Florida (7), Texas (1)","Banned Pending Investigation (1), Banned (7)",
Forever for a Year,"Gottfred, B. T.",2015,9,"When Carolina and Trevor meet on their first day of school, something draws them to each other.  They gradually share first kisses, first touches, first sexual experiences.  When they’re together, nothing else matters. But one of them will make a choice, and the other a mistake, that will break what they thought was unbreakable. Both will wish that they could fall in love again for the first time . . . but first love, by definition, can’t happen twice. Told in Carolina and Trevor's alternating voices, this is an up-close-and-personal story of two teenagers falling in love for the first time, and discovering it might not last forever.","Florida (6), Tennessee (1), Texas (2)","Banned Pending Investigation (1), Banned (6), Banned by Restriction (2)",
Forever…,"Blume, Judy",1975,18,"Katherine and Michael meet at a New Year's Eve party. They're attracted to each other, they grow to love each other. And once they've decided their love is forever, they make love. It's the beginning of an intense and exclusive relationship, with a future all planned. Until Katherine's parents insist that she and Michael put their love to the test with a summer apart... Forever is written for an older age group than Judy Blume's other novels for children. It caused a storm of controversy when it was first published because of its explicit sexual content.","Florida (10), Tennessee (4), Texas (4)","Banned (14), Banned by Restriction (4)",PEN_top_10
Gender Queer: A Memoir,"Kobabe, Maia",2019,7,"In 2014, Maia Kobabe, who uses e/em/eir pronouns, thought that a comic of reading statistics would be the last autobiographical comic e would ever write. At the time, it was the only thing e felt comfortable with strangers knowing about em. Now, Gender Queer is here. Maia's intensely cathartic autobiography charts eir journey of self-identity, which includes the mortification and confusion of adolescent crushes, grappling with how to come out to family and society, bonding with friends over erotic gay fanfiction, and facing the trauma of pap smears. Started as a way to explain to eir family what it means to be nonbinary and asexual, Gender Queer is more than a personal story: it is a useful and touching guide on gender identity—what it means and how to think about it—for advocates, friends, and humans everywhere.","Florida (2), Iowa (1), Nation (1), Pennsylvania (1), Tennessee (1), Texas (1)","Banned Pending Investigation (2), Banned (5)",ALA_top_10
Girl in Translation,"Kwok, Jean",2010,7,"Introducing a fresh, exciting Chinese-American voice, an inspiring debut about an immigrant girl forced to choose between two worlds and two futures. When Kimberly Chang and her mother emigrate from Hong Kong to Brooklyn squalor, she quickly begins a secret double life: exceptional schoolgirl during the day, Chinatown sweatshop worker in the evenings. Disguising the more difficult truths of her life like the staggering degree of her poverty, the weight of her family’s future resting on her shoulders, or her secret love for a factory boy who shares none of her talent or ambition. Kimberly learns to constantly translate not just her language but herself back and forth between the worlds she straddles. Through Kimberly’s story, author Jean Kwok, who also emigrated from Hong Kong as a young girl, brings to the page the lives of countless immigrants who are caught between the pressure to succeed in America, their duty to their family, and their own personal desires, exposing a world that we rarely hear about. Written in an indelible voice that dramatizes the tensions of an immigrant girl growing up between two cultures, surrounded by a language and world only half understood, Girl in Translation is an unforgettable and classic novel of an American immigrant--a moving tale of hardship and triumph, heartbreak and love, and all that gets lost in translation.","Florida (4), Tennessee (1), Texas (2)","Banned Pending Investigation (3), Banned (2), Banned by Restriction (2)",
Glass,"Hopkins, Ellen",2007,9,"Crank. Glass. Ice. Crystal. Whatever you call it, it's all the same: a monster. And once it's got hold of you, this monster will never let you go. Kristina thinks she can control it. Now with a baby to care for, she's determined to be the one deciding when and how much, the one calling the shots. But the monster is too strong, and before she knows it, Kristina is back in its grips. She needs the monster to keep going, to face the pressures of day-to-day life. She needs it to feel alive. Once again the monster takes over Kristina's life and she will do anything for it, including giving up the one person who gives her the unconditional love she craves -- her baby. The sequel to Crank, this is the continuing story of Kristina and her descent back to hell. Told in verse, it's a harrowing and disturbing look at addiction and the damage that it inflicts.","Colorado (1), Florida (3), Tennessee (3), Texas (1), Virginia (1)","Banned (5), Banned Pending Investigation (2), Banned by Restriction (2)",
Grasshopper Jungle,"Smith, Andrew",2014,7,"Sixteen-year-old Austin Szerba interweaves the story of his Polish legacy with the story of how he and his best friend, Robby, brought about the end of humanity and the rise of an army of unstoppable, six-foot tall praying mantises in small-town Iowa. To make matters worse, Austin's hormones are totally oblivious; they don't care that the world is in utter chaos: Austin is in love with his girlfriend, Shann, but remains confused about his sexual orientation. He's stewing in a self-professed constant state of maximum horniness, directed at both Robby and Shann. Ultimately, it's up to Austin to save the world and propagate the species in this sci-fright journey of survival, sex, and the complex realities of the human condition.","Florida (4), Nation (1), Tennessee (1), Texas (1)","Banned (4), Banned Pending Investigation (2), Banned by Restriction (1)",
Grown,"Jackson, Tiffany D.",2020,11,"Author Tiffany D. Jackson delivers another ripped-from-the-headlines mystery that exposes horrific secrets hiding behind the limelight and embraces the power of a young woman's voice. When legendary R&B artist Korey Fields spots Enchanted Jones at an audition, her dreams of being a famous singer take flight. Until Enchanted wakes up with blood on her hands and zero memory of the previous night. Who killed Korey Fields?Before there was a dead body, Enchanted’s dreams had turned into a nightmare. Because behind Korey’s charm and star power was a controlling dark side. Now he’s dead, the police are at the door, and all signs point to Enchanted.","Florida (2), Tennessee (5), Texas (3), Virginia (1)","Banned Pending Investigation (1), Banned (7), Banned by Restriction (3)",
Homegoing,"Gyasi, Yaa",2016,11,"A novel of breathtaking sweep and emotional power that traces three hundred years in Ghana and along the way also becomes a truly great American novel. Extraordinary for its exquisite language, its implacable sorrow, its soaring beauty, and for its monumental portrait of the forces that shape families and nations, Homegoing heralds the arrival of a major new voice in contemporary fiction. Two half-sisters, Effia and Esi, are born into different villages in eighteenth-century Ghana. Effia is married off to an Englishman and lives in comfort in the palatial rooms of Cape Coast Castle. Unbeknownst to Effia, her sister, Esi, is imprisoned beneath her in the castle's dungeons, sold with thousands of others into the Gold Coast's booming slave trade, and shipped off to America, where her children and grandchildren will be raised in slavery. One thread of Homegoing follows Effia's descendants through centuries of warfare in Ghana, as the Fante and Asante nations wrestle with the slave trade and British colonization. The other thread follows Esi and her children into America. From the plantations of the South to the Civil War and the Great Migration, from the coal mines of Pratt City, Alabama, to the jazz clubs and dope houses of twentieth-century Harlem, right up through the present day, Homegoing makes history visceral, and captures, with singular and stunning immediacy, how the memory of captivity came to be inscribed in the soul of a nation. Generation after generation, Yaa Gyasi's magisterial first novel sets the fate of the individual against the obliterating movements of time, delivering unforgettable characters whose lives were shaped by historical forces beyond their control. Homegoing is a tremendous reading experience, not to be missed, by an astonishingly gifted young writer.","Florida (5), Tennessee (1), Texas (5)","Banned Pending Investigation (2), Banned (7), Banned by Restriction (2)",
House of Earth and Blood,"Maas, Sarah J.",2020,9,"Bryce Quinlan had the perfect life-working hard all day and partying all night-until a demon murdered her closest friends, leaving her bereft, wounded, and alone. When the accused is behind bars but the crimes start up again, Bryce finds herself at the heart of the investigation. She'll do whatever it takes to avenge their deaths. Hunt Athalar is a notorious Fallen angel, now enslaved to the Archangels he once attempted to overthrow. His brutal skills and incredible strength have been set to one purpose-to assassinate his boss's enemies, no questions asked. But with a demon wreaking havoc in the city, he's offered an irresistible deal: help Bryce find the murderer, and his freedom will be within reach. As Bryce and Hunt dig deep into Crescent City's underbelly, they discover a dark power that threatens everything and everyone they hold dear, and they find, in each other, a blazing passion-one that could set them both free, if they'd only let it. With unforgettable characters, sizzling romance, and page-turning suspense, this richly inventive new fantasy series by #1 New York Times bestselling author Sarah J. Maas delves into the heartache of loss, the price of freedom-and the power of love.","Florida (7), Tennessee (1), Texas (1)","Banned Pending Investigation (1), Banned (8)",
