book_title,author,year,bans_PEN,text_summary,bans_states,bans_status,list
A Clash of Kings,"Martin, George R. R.",1998,15,"A comet the color of blood and flame cuts across the sky. Two great leaders—Lord Eddard Stark and Robert Baratheon—who hold sway over an age of enforced peace are dead, victims of royal treachery. Now, from the ancient citadel of Dragonstone to the forbidding shores of Winterfell, chaos reigns. Six factions struggle for control of a divided land and the Iron Throne of the Seven Kingdoms, preparing to stake their claims through tempest, turmoil, and war. It is a tale in which brother plots against brother and the dead rise to walk in the night. Here a princess masquerades as an orphan boy; a knight of the mind prepares a poison for a treacherous sorceress; and wild men descend from the Mountains of the Moon to ravage the countryside. Against a backdrop of incest and fratricide, alchemy and murder, victory may go to the men and women possessed of the coldest steel...and the coldest hearts. For when kings clash, the whole land trembles. Here is the second volume in George R.R. Martin magnificent cycle of novels that includes A Game of Thrones and A Storm of Swords. As a whole, this series comprises a genuine masterpiece of modern fantasy, bringing together the best the genre has to offer. Magic, mystery, intrigue, romance, and adventure fill these pages and transport us to a world unlike any we have ever experienced. Already hailed as a classic, George R.R. Martin stunning series is destined to stand as one of the great achievements of imaginative fiction.","Florida (9), Tennessee (3), Texas (2), Utah (1)","Banned Pending Investigation (1), Banned (14)",
A Clockwork Orange,"Burgess, Anthony",1967,23,"In Anthony Burgess's influential nightmare vision of the future, criminals take over after dark. Teen gang leader Alex narrates in fantastically inventive slang that echoes the violent intensity of youth rebelling against society. Dazzling and transgressive, A Clockwork Orange is a frightening fable about good and evil and the meaning of human freedom. This edition includes the controversial last chapter not published in the first edition, and Burgess’s introduction, “A Clockwork Orange Resucked.”","Florida (14), Tennessee (4), Texas (5)","Banned Pending Investigation (2), Banned (20), Banned by Restriction (1)",PEN_top_10
A Court of Frost and Starlight,"Maas, Sarah J.",2019,15,"Feyre, Rhysand, and their friends are still busy rebuilding the Night Court and the vastly altered world beyond, recovering from the war that changed everything. But Winter Solstice is finally approaching, and with it, the joy of a hard-earned reprieve. Yet even the festive atmosphere can't keep the shadows of the past from looming. As Feyre navigates her first Winter Solstice as High Lady, her concern for those dearest to her deepens. They have more wounds than she anticipated-scars that will have a far-reaching impact on the future of their court. Bridging the events of A Court of Wings and Ruin with the later books in the series, A Court of Frost and Starlight explores the far-reaching effects of a devastating war and the fierce love between friends.","Florida (8), Georgia (1), Iowa (2), Tennessee (3), Texas (1)",Banned (15),
A Court of Mist and Fury,"Maas, Sarah J.",2016,18,"The seductive and stunning #1 New York Times bestselling sequel to Sarah J. Maas's spellbinding A Court of Thorns and Roses Feyre has undergone more trials than one human woman can carry in her heart. Though she's now been granted the powers and lifespan of the High Fae, she is haunted by her time Under the Mountain and the terrible deeds she performed to save the lives of Tamlin and his people. As her marriage to Tamlin approaches, Feyre's hollowness and nightmares consume her. She finds herself split into two different one who upholds her bargain with Rhysand, High Lord of the feared Night Court, and one who lives out her life in the Spring Court with Tamlin. While Feyre navigates a dark web of politics, passion, and dazzling power, a greater evil looms. She might just be the key to stopping it, but only if she can harness her harrowing gifts, heal her fractured soul, and decide how she wishes to shape her future-and the future of a world in turmoil. Bestselling author Sarah J. Maas's masterful storytelling brings this second book in her dazzling, sexy, action-packed series to new heights.","Florida (10), Georgia (1), Iowa (2), Tennessee (3), Texas (2)","Banned (17), Banned by Restriction (1)",PEN_top_10
A ​Court of Silver Flames,"Maas, Sarah J.",2021,12,"Sarah J. Maas's sexy, richly imagined series continues with the journey of Feyre's fiery sister, Nesta. Nesta Archeron has always been prickly-proud, swift to anger, and slow to forgive. And ever since being forced into the Cauldron and becoming High Fae against her will, she's struggled to find a place for herself within the strange, deadly world she inhabits. Worse, she can't seem to move past the horrors of the war with Hybern and all she lost in it. The one person who ignites her temper more than any other is Cassian, the battle-scarred warrior whose position in Rhysand and Feyre's Night Court keeps him constantly in Nesta's orbit. But her temper isn't the only thing Cassian ignites. The fire between them is undeniable, and only burns hotter as they are forced into close quarters with each other. Meanwhile, the treacherous human queens who returned to the Continent during the last war have forged a dangerous new alliance, threatening the fragile peace that has settled over the realms. And the key to halting them might very well rely on Cassian and Nesta facing their haunting pasts. Against the sweeping backdrop of a world seared by war and plagued with uncertainty, Nesta and Cassian battle monsters from within and without as they search for acceptance-and healing-in each other's arms.","Florida (6), Georgia (1), Iowa (1), Tennessee (3), Texas (1)",Banned (12),
A Court of Thorns and Roses,"Maas, Sarah J.",2015,16,"When nineteen-year-old huntress Feyre kills a wolf in the woods, a terrifying creature arrives to demand retribution. Dragged to a treacherous magical land she knows about only from legends, Feyre discovers that her captor is not truly a beast, but one of the lethal, immortal faeries who once ruled her world. At least, he’s not a beast all the time. As she adapts to her new home, her feelings for the faerie, Tamlin, transform from icy hostility into a fiery passion that burns through every lie she’s been told about the beautiful, dangerous world of the Fae. But something is not right in the faerie lands. An ancient, wicked shadow is growing, and Feyre must find a way to stop it, or doom Tamlin—and his world—forever. From bestselling author Sarah J. Maas comes a seductive, breathtaking book that blends romance, adventure, and faerie lore into an unforgettable read.","Florida (7), Georgia (1), Iowa (2), Minnesota (1), Tennessee (3), Texas (2)","Banned (14), Banned Pending Investigation (1), Banned by Restriction (1)",PEN_top_10
A Court of Wings and Ruin,"Maas, Sarah J.",2017,14,"The epic third novel in the #1 New York Times bestselling Court of Thorns and Roses series by Sarah J. Maas. Feyre has returned to the Spring Court, determined to gather information on Tamlin's actions and learn what she can about the invading king threatening to bring her land to its knees. But to do so she must play a deadly game of deceit. One slip could bring doom not only for Feyre, but for everything-and everyone-she holds dear. As war bears down upon them all, Feyre endeavors to take her place amongst the High Fae of the land, balancing her struggle to master her powers-both magical and political-and her love for her court and family. Amidst these struggles, Feyre and Rhysand must decide whom to trust amongst the cunning and lethal High Lords, and hunt for allies in unexpected places. In this thrilling third book in the #1 New York Times bestselling series from Sarah J. Maas, the fate of Feyre's world is at stake as armies grapple for power over the one thing that could destroy it.","Florida (7), Georgia (1), Iowa (2), Tennessee (3), Texas (1)","Banned (13), Banned Pending Investigation (1)",
A Game of Thrones,"Martin, George R. R.",1996,7,"Long ago, in a time forgotten, a preternatural event threw the seasons out of balance. In a land where summers can last decades and winters a lifetime, trouble is brewing. The cold is returning, and in the frozen wastes to the north of Winterfell, sinister forces are massing beyond the kingdom’s protective Wall. To the south, the king’s powers are failing—his most trusted adviser dead under mysterious circumstances and his enemies emerging from the shadows of the throne. At the center of the conflict lie the Starks of Winterfell, a family as harsh and unyielding as the frozen land they were born to. Now Lord Eddard Stark is reluctantly summoned to serve as the king’s new Hand, an appointment that threatens to sunder not only his family but the kingdom itself. Sweeping from a harsh land of cold to a summertime kingdom of epicurean plenty, A Game of Thrones tells a tale of lords and ladies, soldiers and sorcerers, assassins and bastards, who come together in a time of grim omens. Here an enigmatic band of warriors bear swords of no human metal; a tribe of fierce wildlings carry men off into madness; a cruel young dragon prince barters his sister to win back his throne; a child is lost in the twilight between life and death; and a determined woman undertakes a treacherous journey to protect all she holds dear. Amid plots and counter-plots, tragedy and betrayal, victory and terror, allies and enemies, the fate of the Starks hangs perilously in the balance, as each side endeavors to win that deadliest of conflicts: the game of thrones.","Florida (2), Tennessee (3), Texas (2)",Banned (7),
A Stolen Life,"Dugard, Jaycee",2011,14,"On 10 June 1991, eleven-year-old Jaycee Dugard was abducted from a school bus stop within sight of her home in Tahoe, California. It was the last her family and friends saw of her for over eighteen years. On 26 August 2009, Dugard, her daughters, and Phillip Craig Garrido appeared in the office of her kidnapper's parole officer in California. Their unusual behaviour sparked an investigation that led to the positive identification of Jaycee Lee Dugard, living in a tent behind Garrido's home. During her time in captivity, at the age of fourteen and seventeen, she gave birth to two daughters, both fathered by Garrido. Dugard's memoir is written by the 30-year-old herself and covers the period from the time of her abduction in 1991 up until the present. In her stark, utterly honest and unflinching narrative, Jaycee opens up about what she experienced, including how she feels now, a year after being found. Garrido and his wife Nancy have since pleaded guilty to their crimes.","Florida (7), Georgia (1), Pennsylvania (1), Tennessee (2), Texas (3)","Banned Pending Investigation (1), Banned (10), Banned by Restriction (3)",
All Boys Aren’t Blue,"Johnson, George M.",2020,16,"In a series of personal essays, prominent journalist and LGBTQIA+ activist George M. Johnson explores his childhood, adolescence, and college years in New Jersey and Virginia. From the memories of getting his teeth kicked out by bullies at age five, to flea marketing with his loving grandmother, to his first sexual relationships, this young-adult memoir weaves together the trials and triumphs faced by Black queer boys. Both a primer for teens eager to be allies as well as a reassuring testimony for young queer men of color, All Boys Aren't Blue covers topics such as gender identity, toxic masculinity, brotherhood, family, structural marginalization, consent, and Black joy. Johnson's emotionally frank style of writing will appeal directly to young adults.","Florida (5), Georgia (1), Missouri (1), Nation (1), Oregon (1), Tennessee (4), Texas (2), Wisconsin (1)","Banned (13), Banned by Restriction (3)","ALA_top_10, PEN_top_10"
All the Things We Do in the Dark,"Mitchell, Saundra",2019,7,"Sadie meets Girl in Pieces in this dark, emotional thriller by acclaimed author Saundra Mitchell. Something happened to Ava. The curving scar on her face is proof. Ava would rather keep that something hidden—buried deep in her heart and her soul. But in the woods on the outskirts of town, the traces of someone else’s secrets lie frozen, awaiting Ava’s discovery—and what Ava finds threatens to topple the carefully constructed wall of normalcy that she’s spent years building around her. Secrets leave scars. But when the secret in question is not your own—do you ignore the truth and walk away? Or do you uncover it from its shallow grave and let it reopen old wounds—wounds that have finally begun to heal?","Florida (4), Tennessee (1), Texas (2)","Banned (4), Banned Pending Investigation (2), Banned by Restriction (1)",
Allegedly,"Jackson, Tiffany D.",2017,8,"Allegedly. She didn’t say much in that first interview with detectives, and the media filled in the only blanks that mattered: A white baby had died while under the care of a churchgoing black woman and her nine-year-old daughter. The public convicted Mary and the jury made it official. But did she do it? She wouldn’t say. Mary survived six years in baby jail before being dumped in a group home. The house isn’t really “home”—no place where you fear for your life can be considered a home. Home is Ted, who she meets on assignment at a nursing home. There wasn’t a point to setting the record straight before, but now she’s got Ted—and their unborn child—to think about. When the state threatens to take her baby, Mary must find the voice to fight her past. And her fate lies in the hands of the one person she distrusts the most: her Momma. No one knows the real Momma. But who really knows the real Mary?","Florida (2), Tennessee (2), Texas (3), Virginia (1)","Banned Pending Investigation (1), Banned (5), Banned by Restriction (2)",
Almost Perfect,"Katcher, Brian",2009,8,"Logan Witherspoon recently discovered that his girlfriend of three years cheated on him. But things start to look up when a new student breezes through the halls of his small-town high school. Sage Hendricks befriends Logan at a time when he no longer trusts or believes in people. Sage has been homeschooled for a number of years and her parents have forbidden her to date anyone, but she won't tell Logan why. One day, Logan acts on his growing feelings for Sage. Moments later, he wishes he never had. Sage finally discloses her big secret: she was born a boy. Enraged, frightened, and feeling betrayed, Logan lashes out at Sage and disowns her. But once Logan comes to terms with what happened, he reaches out to Sage in an attempt to understand her situation. But Logan has no idea how rocky the road back to friendship will be.","Florida (3), Nation (1), Tennessee (1), Texas (2), Virginia (1)","Banned (5), Banned Pending Investigation (1), Banned by Restriction (2)",
American Psycho,"Ellis, Bret Easton",1991,8,"Patrick Bateman is twenty-six and works on Wall Street. He is handsome, sophisticated, charming and intelligent. He is also a psychopath. Taking us to head-on collision with America's greatest dream—and its worst nightmare—American Psycho is a bleak, bitter, black comedy about a world we all recognize but do not wish to confront.","Florida (5), Georgia (1), Pennsylvania (1), Texas (1)","Banned Pending Investigation (1), Banned (6), Banned by Restriction (1)",
Anatomy of a Boyfriend,"Snadowsky, Daria",2007,7,"Before this all happened, the closest I'd ever come to getting physical with a guy was playing the board game Operation. Okay, so maybe that sounds pathetic, but it's not like there were any guys at my high school who I cared to share more than three words with, let alone my body. Then I met Wes, a track star senior from across town. Maybe it was his soulful blue eyes, or maybe my hormones just started raging. Either way, I was hooked. And after a while, he was too. I couldn't believe how intense my feelings became, or the fact that I was seeing—and touching—parts of the body I'd only read about in my Gray's Anatomy textbook. You could say Wes and I experienced a lot of firsts together that spring. It was scary. It was fun. It was love. And then came the fall.",Florida (7),Banned (7),
And They Lived...,"Salvatore, Steven",2022,7,"Chase Arthur is a budding animator and hopeless romantic obsessed with Disney films and finding his true love, but he's plagued with the belief that he's not enough for anyone: he's recovering from an eating disorder and suffers from body dysmorphia fueled by his father, and can't quite figure out his gender identity. When Chase starts his freshman year of college, he has to navigate being away from home and missing his sister, finding his squad, and contending with his ex-best friend Leila who is gunning for the same exclusive mentorship. If only he can pull together a short for the freshman animation showcase at the end of the semester. Then Chase meets Jack Reid, a pragmatic poet who worships words and longs to experience life outside of his sheltered world. But Chase throws everything into question for Jack, who is still discovering his sexual identity, having grown up in close-knit conservative family. Jack internalized a lot of homophobia from his parents and childhood best friend, who unexpectedly visit campus, which threatens to destroy their relationship. Chase will have to learn to love--and be enough for--himself, while discovering what it means to truly live.","Florida (5), Tennessee (1), Utah (1)","Banned Pending Investigation (1), Banned (5), Banned by Restriction (1)",
Ask the Passengers,"King, A. S.",2012,8,"Astrid Jones desperately wants to confide in someone, but her mother's pushiness and her father's lack of interest tell her they're the last people she can trust. Instead, Astrid spends hours lying on the backyard picnic table watching airplanes fly overhead. She doesn't know the passengers inside, but they're the only people who won't judge her when she asks them her most personal questions--like what it means that she's falling in love with a girl. As her secret relationship becomes more intense and her friends demand answers, Astrid has nowhere left to turn. She can't share the truth with anyone except the people at thirty thousand feet, and they don't even know she's there. But little does Astrid know just how much even the tiniest connection will affect these strangers' lives--and her own--for the better. In this truly original portrayal of a girl struggling to break free of society's definitions, Printz Honor author A.S. King asks readers to question everything--and offers hope to those who will never stop seeking real love.","Florida (3), Tennessee (3), Texas (2)","Banned Pending Investigation (2), Banned (5), Banned by Restriction (1)",
Beautiful,"Reed, Amy",2009,12,"When Cassie moves from the tiny town where she has always lived to a suburb of Seattle, she is determined to leave her boring, good-girl existence behind. This is Cassie’s chance to stop being invisible and become the kind of girl who’s worth noticing. Stepping into her new identity turns out to be easier than Cassie could have ever imagined… one moment, one choice, changes everything. Cassie’s new existence both thrills and terrifies her. Swept into a world of illicit parties and social landmines, she sheds her virginity, embraces the numbness she feels from the drugs, and floats through it all, knowing that she is now called beautiful. She ignores the dangers of her fast-paced life… but she can’t sidestep the secrets and the cruelty. Cassie is trapped in a swift downward spiral tinged with violence and abuse, and no one—not even the one person she thought she could trust—can help her now.","Florida (9), Iowa (1), Tennessee (1), Wyoming (1)","Banned (11), Banned by Restriction (1)",
Beloved,"Morrison, Toni",1987,11,"Staring unflinchingly into the abyss of slavery, this spellbinding novel transforms history into a story as powerful as Exodus and as intimate as a lullaby. Sethe, its protagonist, was born a slave and escaped to Ohio, but eighteen years later she is still not free. She has too many memories of Sweet Home, the beautiful farm where so many hideous things happened. And Sethe's new home is haunted by the ghost of her baby, who died nameless and whose tombstone is engraved with a single word: Beloved. Filled with bitter poetry and suspense as taut as a rope, Beloved is a towering achievement by Nobel Prize laureate Toni Morrison.","Colorado (1), Florida (3), Iowa (2), Tennessee (2), Texas (2), Virginia (1)","Banned (8), Banned Pending Investigation (1), Banned by Restriction (2)",
Beyond Magenta: Transgender Teens Speak Out,"Kuklin, Susan",2014,10,"A groundbreaking work of LGBT literature takes an honest look at the life, love, and struggles of transgender teens. Author and photographer Susan Kuklin met and interviewed six transgender or gender-neutral young adults and used her considerable skills to represent them thoughtfully and respectfully before, during, and after their personal acknowledgment of gender preference. Portraits, family photographs, and candid images grace the pages, augmenting the emotional and physical journey each youth has taken. Each honest discussion and disclosure, whether joyful or heartbreaking, is completely different from the other because of family dynamics, living situations, gender, and the transition these teens make in recognition of their true selves.","Florida (4), Iowa (1), Nation (1), Pennsylvania (1), Texas (3)","Banned by Restriction (3), Banned Pending Investigation (3), Banned (4)",
Breathless,"Niven, Jennifer",2020,20,"From Jennifer Niven, the #1 New York Times bestselling author of All the Bright Places, comes an unforgettable new novel about a sensitive girl ready to live her bravest life--sex, heartbreak, family dramas, and all. Before: With graduation on the horizon, budding writer Claudine Henry is focused on three things: college in the fall, become a famous author, and the ever-elusive possibility of sex. She doesn't even need to be in love--sex is all she's looking for. Then her dad drops a bombshell: he and Claude's mom are splitting up. Suddenly, Claude's entire world feels like a lie, and the ground under her feet anything but stable. After: Claude's mom whisks them both away to a remote, mosquito-infested island off the coast of Georgia, a place where the two of them can start the painful process of mending their broken hearts. It's the last place Claude can imagine finding her footing, but then Jeremiah Crew happens. Miah is a local trail guide with a passion for photography, and a past he doesn't like to talk about. He's brash, enigmatic, and even more infuriatingly, he's the only one who seems to see Claude for who she wants to be. So when Claude decides to sleep with Miah, she tells herself it's just sex--exactly what she has planned. There isn't enough time to fall in love, especially if it means putting her already broken heart at risk. Compulsively readable and impossible to forget, Jennifer Niven's luminous new novel is an insightful portrait of a young woman determined to write her own next chapter--sex, resilience, mosquito bites, and all.With graduation on the horizon, budding writer Claudine Henry is focused on three things: college in the fall, become a famous author, and the ever-elusive possibility of sex. Then her dad drops a bombshell: he and Claude's mom are splitting up. Claude's mom whisks them both away to a remote, mosquito-infested island off the coast of Georgia, where the two of them can start the painful process of mending their broken hearts. It's the last place Claude can imagine finding her footing, but then Jeremiah Crew happens. Miah is a local trail guide with a passion for photography, and a past he doesn't like to talk about. He's brash, enigmatic, and even more infuriatingly, he's the only one who seems to see Claude for who she wants to be. When Claude decides to sleep with Miah, she tells herself it's just sex-- she's not going to put her already broken heart at risk. ","Florida (11), Iowa (1), Tennessee (3), Texas (3), Utah (1), Virginia (1)","Banned (17), Banned Pending Investigation (1), Banned by Restriction (2)",PEN_top_10
