book_title,author,year,bans_PEN,text_summary,bans_states,bans_status,list
The DUFF: Designated Ugly Fat Friend,"Keplinger, Kody",2010,16,"Seventeen-year-old Bianca Piper is cynical and loyal, and she doesn't think she's the prettiest of her friends by a long shot. She's also way too smart to fall for the charms of man-slut and slimy school hottie Wesley Rush. In fact, Bianca hates him. And when he nicknames her ""the Duff,"" she throws her Coke in his face. But things aren't so great at home right now, and Bianca is desperate for a distraction. She ends up kissing Wesley. Worse, she likes it. Eager for escape, Bianca throws herself into a closeted enemies-with-benefits relationship with him. Until it all goes horribly awry. It turns out Wesley isn't such a bad listener, and his life is pretty screwed up, too. Suddenly Bianca realizes with absolute horror that she’s falling for the guy she thought she hated more than anyone.","Florida (11), Tennessee (2), Texas (3)","Banned Pending Investigation (1), Banned (13), Banned by Restriction (2)",PEN_top_10
The Fault in Our Stars,"Green, John",2012,8,"Despite the tumor-shrinking medical miracle that has bought her a few years, Hazel has never been anything but terminal, her final chapter inscribed upon diagnosis. But when a gorgeous plot twist named Augustus Waters suddenly appears at Cancer Kid Support Group, Hazel's story is about to be completely rewritten. Insightful, bold, irreverent, and raw, The Fault in Our Stars is award-winning author John Green's most ambitious and heartbreaking work yet, brilliantly exploring the funny, thrilling, and tragic business of being alive and in love.","Georgia (1), Iowa (1), Tennessee (3), Texas (3)","Banned by Restriction (2), Banned (6)",
The Female of the Species,"McGinnis, Mindy",2016,10,"A contemporary YA novel that examines rape culture through alternating perspectives. Alex Craft knows how to kill someone. And she doesn’t feel bad about it. Three years ago, when her older sister, Anna, was murdered and the killer walked free, Alex uncaged the language she knows best—the language of violence. While her own crime goes unpunished, Alex knows she can’t be trusted among other people. Not with Jack, the star athlete who wants to really know her but still feels guilty over the role he played the night Anna’s body was discovered. And not with Peekay, the preacher’s kid with a defiant streak who befriends Alex while they volunteer at an animal shelter. Not anyone. As their senior year unfolds, Alex’s darker nature breaks out, setting these three teens on a collision course that will change their lives forever.","Florida (3), Iowa (1), Tennessee (2), Texas (3), Virginia (1)","Banned Pending Investigation (2), Banned (6), Banned by Restriction (2)",
The Freedom Writers Diary,"Gruwell, Erin",1999,8,"The twentieth anniversary edition of the classic story of an incredible group of students and the teacher who inspired them, featuring updates on the students’ lives, new journal entries, and an introduction by Erin Gruwell Now a public television documentary,  Freedom Writers: Stories from the Heart In 1994, an idealistic first-year teacher in Long Beach, California, named Erin Gruwell confronted a room of “unteachable, at-risk” students. She had intercepted a note with an ugly racial caricature and angrily declared that this was precisely the sort of thing that led to the Holocaust. She was met by uncomprehending looks—none of her students had heard of one of the defining moments of the twentieth century. So she rebooted her entire curriculum, using treasured books such as Anne Frank’s diary as her guide to combat intolerance and misunderstanding. Her students began recording their thoughts and feelings in their own diaries, eventually dubbing themselves the “Freedom Writers.” Consisting of powerful entries from the students’ diaries and narrative text by Erin Gruwell,  The Freedom Writers Diary  is an unforgettable story of how hard work, courage, and determination changed the lives of a teacher and her students. In the two decades since its original publication, the book has sold more than one million copies and inspired a major motion picture  Freedom Writers . And now, with this twentieth-anniversary edition, readers are brought up to date on the lives of the Freedom Writers, as they blend indispensable takes on social issues with uplifting stories of attending college—and watch their own children follow in their footsteps.  The Freedom Writers Diary  remains a vital read for anyone who believes in second chances.","Florida (2), Tennessee (1), Texas (5)","Banned Pending Investigation (1), Banned (5), Banned by Restriction (2)",
The Glass Castle,"Walls, Jeannette",2005,8,"The Glass Castle is a remarkable memoir of resilience and redemption, and a revelatory look into a family at once deeply dysfunctional and uniquely vibrant. When sober, Jeannette's brilliant and charismatic father captured his children's imagination, teaching them physics, geology, and how to embrace life fearlessly. But when he drank, he was dishonest and destructive. Her mother was a free spirit who abhorred the idea of domesticity and didn't want the responsibility of raising a family. The Walls children learned to take care of themselves. They fed, clothed, and protected one another, and eventually found their way to New York. Their parents followed them, choosing to be homeless even as their children prospered. The Glass Castle is truly astonishing--a memoir permeated by the intense love of a peculiar but loyal family.","Florida (4), Iowa (1), Texas (2), Virginia (1)","Banned (4), Banned Pending Investigation (2), Banned by Restriction (2)",
The Handmaid's Tale,"Atwood, Margaret",1985,14,"Now a Hulu series starring Elizabeth Moss. The Handmaid's Tale is an instant classic and eerily prescient cultural phenomenon, from ""the patron saint of feminist dystopian fiction"" ( New York Times ) The Handmaid’s Tale is a novel of such power that the reader will be unable to forget its images and its forecast. Set in the near future, it describes life in what was once the United States and is now called the Republic of Gilead, a monotheocracy that has reacted to social unrest and a sharply declining birthrate by reverting to, and going beyond, the repressive intolerance of the original Puritans. The regime takes the Book of Genesis absolutely at its word, with bizarre consequences for the women and men in its population. The story is told through the eyes of Offred, one of the unfortunate Handmaids under the new social order. In condensed but eloquent prose, by turns cool-eyed, tender, despairing, passionate, and wry, she reveals to us the dark corners behind the establishment’s calm facade, as certain tendencies now in existence are carried to their logical conclusions. The Handmaid’s Tale is funny, unexpected, horrifying, and altogether convincing. It is at once scathing satire, dire warning, and a tour de force. It is Margaret Atwood at her best.","Florida (3), Indiana (1), Iowa (2), Minnesota (1), Tennessee (3), Texas (3), Virginia (1)","Banned (9), Banned Pending Investigation (2), Banned by Restriction (3)",
The Hate U Give,"Thomas, Angie",2017,12,"Sixteen-year-old Starr Carter moves between two worlds: the poor neighborhood where she lives and the fancy suburban prep school she attends. The uneasy balance between these worlds is shattered when Starr witnesses the fatal shooting of her childhood best friend Khalil at the hands of a police officer. Khalil was unarmed. Soon afterward, his death is a national headline. Some are calling him a thug, maybe even a drug dealer and a gangbanger. Protesters are taking to the streets in Khalil’s name. Some cops and the local drug lord try to intimidate Starr and her family. What everyone wants to know is: what really went down that night? And the only person alive who can answer that is Starr. But what Starr does—or does not—say could upend her community. It could also endanger her life.","Colorado (1), Florida (5), Iowa (1), Tennessee (2), Texas (2), Utah (1)","Banned (7), Banned by Restriction (2), Banned Pending Investigation (3)",
The Haters,"Andrews, Jesse",2016,13,"From Jesse Andrews, author of the New York Times bestselling Me and Earl and the Dying Girl and screenwriter of the Sundance award–winning motion picture of the same name, comes a groundbreaking young adult novel about music, love, friendship, and freedom as three young musicians follow a quest to escape the law long enough to play the amazing show they hope (but also doubt) they have in them. Inspired by the years he spent playing bass in a band himself, The Haters is Jesse Andrews's road trip adventure about a trio of jazz-camp escapees who, against every realistic expectation, become a band. For Wes and his best friend, Corey, jazz camp turns out to be lame. It's pretty much all dudes talking in Jazz Voice. But then they jam with Ash, a charismatic girl with an unusual sound, and the three just click. It's three and a half hours of pure musical magic, and Ash makes a decision: They need to hit the road. Because the road, not summer camp, is where bands get good. Before Wes and Corey know it, they're in Ash's SUV heading south, and The Haters Summer of Hate Tour has begun. In his second novel, Andrews again brings his brilliant and distinctive voice to YA, in the perfect book for music lovers, fans of The Commitments and High Fidelity, or anyone who has ever loved—and hated—a song or a band. This witty, funny coming-of-age novel is contemporary fiction at its best.","Florida (5), Iowa (2), Pennsylvania (1), Tennessee (2), Texas (2), Virginia (1)","Banned (9), Banned Pending Investigation (2), Banned by Restriction (2)",
The Infinite Moment of Us,"Myracle, Lauren",2013,11,"For as long as she can remember, Wren Gray’s goal has been to please her parents. But as high school graduation nears, so does an uncomfortable realization: Pleasing her parents once overlapped with pleasing herself, but now... not so much. Wren needs to honor her own desires, but how can she if she doesn’t even know what they are?","Florida (4), Georgia (1), Iowa (2), Tennessee (1), Texas (3)","Banned (9), Banned Pending Investigation (1), Banned by Restriction (1)",
The Kite Runner,"Hosseini, Khaled",2003,12,"The unforgettable, heartbreaking story of the unlikely friendship between a wealthy boy and the son of his father's servant, The Kite Runner is a beautifully crafted novel set in a country that is in the process of being destroyed. It is about the power of reading, the price of betrayal, and the possibility of redemption; and an exploration of the power of fathers over sons—their love, their sacrifices, their lies. A sweeping story of family, love, and friendship told against the devastating backdrop of the history of Afghanistan over the last thirty years, The Kite Runner is an unusual and powerful novel that has become a beloved, one-of-a-kind classic. The 10th anniversary edition of the New York Times bestseller and international classic loved by millions of readers.","Colorado (1), Florida (2), Iowa (1), Minnesota (1), Tennessee (3), Texas (4)","Banned (9), Banned Pending Investigation (2), Banned by Restriction (1)",
The Lovely Bones,"Sebold, Alice",2002,9,"""My name was Salmon, like the fish; first name, Susie. I was fourteen when I was murdered on December 6, 1973."" So begins the story of Susie Salmon, who is adjusting to her new home in heaven, a place that is not at all what she expected, even as she is watching life on earth continue without her -- her friends trading rumors about her disappearance, her killer trying to cover his tracks, her grief-stricken family unraveling. Out of unspeakable tragedy and loss, The Lovely Bones succeeds, miraculously, in building a tale filled with hope, humor, suspense, even joy.","Florida (4), Tennessee (2), Texas (3)","Banned Pending Investigation (2), Banned by Restriction (2), Banned (5)",
The Perks of Being a Wallflower,"Chbosky, Stephen",2009,17,"standing on the fringes of life... offers a unique perspective. But there comes a time to see what it looks like from the dance floor. This haunting novel about the dilemma of passivity vs. passion marks the stunning debut of a provocative new voice in contemporary fiction: The Perks of Being A WALLFLOWER This is the story of what it's like to grow up in high school. More intimate than a diary, Charlie's letters are singular and unique, hilarious and devastating. We may not know where he lives. We may not know to whom he is writing. All we know is the world he shares. Caught between trying to live his life and trying to run from it puts him on a strange course through uncharted territory. The world of first dates and mixed tapes, family dramas and new friends. The world of sex, drugs, and The Rocky Horror Picture Show, when all one requires is that the perfect song on that perfect drive to feel infinite. Through Charlie, Stephen Chbosky has created a deeply affecting coming-of-age story, a powerful novel that will spirit you back to those wild and poignant roller coaster days known as growing up.","Arizona (1), Colorado (1), Florida (3), Iowa (2), Minnesota (1), Pennsylvania (1), Tennessee (4), Texas (3), Virginia (1)","Banned by Restriction (3), Banned (11), Banned Pending Investigation (3)","ALA_top_10, PEN_top_10"
The Poet X,"Acevedo, Elizabeth",2018,10,"Fans of Jacqueline Woodson, Meg Medina, and Jason Reynolds will fall hard for this astonishing New York Times-bestselling novel-in-verse by an award-winning slam poet, about an Afro-Latina heroine who tells her story with blazing words and powerful truth. Xiomara Batista feels unheard and unable to hide in her Harlem neighborhood. Ever since her body grew into curves, she has learned to let her fists and her fierceness do the talking. But Xiomara has plenty she wants to say, and she pours all her frustration and passion onto the pages of a leather notebook, reciting the words to herself like prayers—especially after she catches feelings for a boy in her bio class named Aman, who her family can never know about. With Mami’s determination to force her daughter to obey the laws of the church, Xiomara understands that her thoughts are best kept to herself. So when she is invited to join her school’s slam poetry club, she doesn’t know how she could ever attend without her mami finding out. But she still can’t stop thinking about performing her poems. Because in the face of a world that may not want to hear her, Xiomara refuses to be silent.","Florida (4), Tennessee (2), Texas (4)","Banned (6), Banned Pending Investigation (2), Banned by Restriction (2)",
The Sun and Her Flowers,"Kaur, Rupi",2018,11,"From Rupi Kaur, the #1 New York Times bestselling author of milk and honey, comes her long-awaited second collection of poetry. A vibrant and transcendent journey about growth and healing. Ancestry and honoring one’s roots. Expatriation and rising up to find a home within yourself. Divided into five chapters and illustrated by Kaur, the sun and her flowers is a journey of wilting, falling, rooting, rising, and blooming. A celebration of love in all its forms. this is the recipe of life said my mother as she held me in her arms as i wept think of those flowers you plant in the garden each year they will teach you that people too must wilt fall root rise in order to bloom","Florida (4), Georgia (1), Iowa (1), Tennessee (4), Texas (1)","Banned (10), Banned Pending Investigation (1)",
The Truth About Alice: A Novel,"Mathieu, Jennifer",2014,9,"Everyone knows Alice slept with two guys at one party. But did you know Alice was sexting Brandon when he crashed his car? It's true. Ask ANYBODY. Rumor has it that Alice Franklin is a slut. It's written all over the bathroom stall at Healy High for everyone to see. And after star quarterback Brandon Fitzsimmons dies in a car accident, the rumors start to spiral out of control. In this remarkable debut novel, four Healy High students—the girl who has the infamous party, the car accident survivor, the former best friend, and the boy next door—tell all they know. But exactly what is the truth about Alice? In the end there's only one person to ask: Alice herself.","Florida (2), Tennessee (3), Texas (3), Virginia (1)","Banned Pending Investigation (1), Banned (6), Banned by Restriction (2)",
The Upside of Unrequited,"Albertalli, Becky",2017,9,"Seventeen-year-old Molly Peskin-Suso knows all about unrequited love—she’s lived through it twenty-six times. She crushes hard and crushes often, but always in secret. Because no matter how many times her twin sister, Cassie, tells her to woman up, Molly can’t stomach the idea of rejection. So she’s careful. Fat girls always have to be careful. Then a cute new girl enters Cassie’s orbit, and for the first time ever, Molly’s cynical twin is a lovesick mess. Meanwhile, Molly’s totally not dying of loneliness—except for the part where she is. Luckily, Cassie’s new girlfriend comes with a cute hipster-boy sidekick. Will is funny and flirtatious and just might be perfect crush material. Maybe more than crush material. And if Molly can win him over, she’ll get her first kiss and she’ll get her twin back. There’s only one problem: Molly’s coworker Reid. He’s an awkward Tolkien superfan with a season pass to the Ren Faire, and there’s absolutely no way Molly could fall for him. Right?","Florida (3), Tennessee (3), Texas (3)","Banned by Restriction (2), Banned Pending Investigation (1), Banned (6)",
The You I've Never Known,"Hopkins, Ellen",2017,9,"How do you live your life if your past is based on a lie? A new novel in both verse and prose from #1 New York Times bestselling author, Ellen Hopkins. For as long as she can remember, it’s been just Ariel and Dad. Ariel’s mom disappeared when she was a baby. Dad says home is wherever the two of them are, but Ariel is now seventeen and after years of new apartments, new schools, and new faces, all she wants is to put down some roots. Complicating things are Monica and Gabe, both of whom have stirred a different kind of desire. Maya’s a teenager who’s run from an abusive mother right into the arms of an older man she thinks she can trust. But now she’s isolated with a baby on the way, and life’s getting more complicated than Maya ever could have imagined. Ariel and Maya’s lives collide unexpectedly when Ariel’s mother shows up out of the blue with wild accusations: Ariel wasn’t abandoned. Her father kidnapped her fourteen years ago. What is Ariel supposed to believe? Is it possible Dad’s woven her entire history into a tapestry of lies? How can she choose between the mother she’s been taught to mistrust and the father who has taken care of her all these years? In bestselling author Ellen Hopkins’s deft hands, Ariel’s emotionally charged journey to find out the truth of who she really is balances beautifully with Maya’s story of loss and redemption. This is a memorable portrait of two young women trying to make sense of their lives and coming face to face with themselves—for both the last and the very first time.","Florida (3), Tennessee (2), Texas (3), Virginia (1)","Banned (5), Banned Pending Investigation (1), Banned by Restriction (3)",
Thirteen Reasons Why,"Asher, Jay",2007,14,"Clay Jensen returns home from school to find a strange package with his name on it lying on his porch. Inside he discovers several cassette tapes recorded by Hannah Baker–his classmate and crush–who committed suicide two weeks earlier. Hannah’s voice tells him that there are thirteen reasons why she decided to end her life. Clay is one of them. If he listens, he’ll find out why. Clay spends the night crisscrossing his town with Hannah as his guide. He becomes a firsthand witness to Hannah’s pain, and as he follows Hannah’s recorded words throughout his town, what he discovers changes his life forever.","Colorado (1), Florida (1), Iowa (2), Tennessee (5), Texas (4), Virginia (1)","Banned (10), Banned Pending Investigation (1), Banned by Restriction (3)",
This Book Is Gay,"Dawson, Juno",2014,10,"Lesbian. Bisexual. Queer. Transgender. Straight. Curious. This book is for everyone, regardless of gender or sexual preference. This book is for anyone who's ever dared to wonder. This book is for YOU. There's a long-running joke that, after ""coming out,"" a lesbian, gay guy, bisexual, or trans person should receive a membership card and instruction manual. THIS IS THAT INSTRUCTION MANUAL. You're welcome. Inside you'll find the answers to all the questions you ever wanted to ask: from sex to politics, hooking up to stereotypes, coming out and more. This candid, funny, and uncensored exploration of sexuality and what it's like to grow up LGBT also includes real stories from people across the gender and sexual spectrums, not to mention hilarious illustrations. You will be entertained. You will be informed. But most importantly, you will know that however you identify (or don't) and whomever you love, you are exceptional. You matter. And so does this book.","Florida (5), Georgia (1), Iowa (1), Nation (1), Tennessee (1), Texas (1)","Banned Pending Investigation (1), Banned (9)",
This Is Kind of an Epic Love Story,"Callender, Kacen",2018,12,"A fresh, charming rom-com perfect for fans of Simon vs. the Homo Sapiens Agenda and Boy Meets Boy about Nathan Bird, who has sworn off happy endings but is sorely tested when his former best friend, Ollie, moves back to town. Nathan Bird doesn’t believe in happy endings. Although he’s the ultimate film buff and an aspiring screenwriter, Nate’s seen the demise of too many relationships to believe that happy endings exist in real life. Playing it safe to avoid a broken heart has been his MO ever since his father died and left his mom to unravel—but this strategy is not without fault. His best-friend-turned-girlfriend-turned-best-friend-again, Florence, is set on making sure Nate finds someone else. And in a twist that is rom-com-worthy, someone does come along: Oliver James Hernández, his childhood best friend. After a painful mix-up when they were little, Nate finally has the chance to tell Ollie the truth about his feelings. But can Nate find the courage to pursue his own happily ever after?","Florida (5), Tennessee (3), Texas (3), Utah (1)","Banned Pending Investigation (1), Banned (10), Banned by Restriction (1)",
This One Summer,"Tamaki, Mariko",2014,11,"Every summer, Rose goes with her mom and dad to a lake house in Awago Beach. It's their getaway, their refuge. Rosie's friend Windy is always there, too, like the little sister she never had. But this summer is different. Rose's mom and dad won't stop fighting, and when Rose and Windy seek a distraction from the drama, they find themselves with a whole new set of problems. It's a summer of secrets and sorrow and growing up, and it's a good thing Rose and Windy have each other. In This One Summer two stellar creators redefine the teen graphic novel. Cousins Mariko and Jillian Tamaki, the team behind Skim, have collaborated on this gorgeous, heartbreaking, and ultimately hopeful story about a girl on the cusp of her teen age—a story of renewal and revelation.","Florida (4), Tennessee (2), Texas (3), Utah (1), Virginia (1)","Banned (6), Banned Pending Investigation (2), Banned by Restriction (3)",
Tilt,"Hopkins, Ellen",2012,14,"Love—good and bad—forces three teens’ worlds to tilt in a riveting novel from New York Times bestselling author Ellen Hopkins. Three teens, three stories—all interconnected through their parents’ family relationships. As the adults pull away, caught up in their own dilemmas, the lives of the teens begin to tilt…. Mikayla, almost eighteen, is over-the-top in love with Dylan, who loves her back jealously. But what happens to that love when Mikayla gets pregnant the summer before their senior year—and decides to keep the baby? Shane turns sixteen that same summer and falls hard in love with his first boyfriend, Alex, who happens to be HIV positive. Shane has lived for four years with his little sister’s impending death. Can he accept Alex’s love, knowing that his life, too, will be shortened? Harley is fourteen—a good girl searching for new experiences, especially love from an older boy. She never expects to hurdle toward self-destructive extremes in order to define who she is and who she wants to be. Love, in all its forms, has crucial consequences in this standalone novel.","Florida (9), Iowa (1), Tennessee (2), Texas (1), Virginia (1)","Banned Pending Investigation (1), Banned (12), Banned by Restriction (1)",
